{
    "id": 13625,
    "title": "BSE Clearing Ltd: Excellence in Central Counterparty Resilience Management India 2026",
    "slug": "bse-clearing-ltd-formerly-iccl-excellence-in-central-counterparty-resilience-management-india-2026",
    "url": "https://cfi.co/awards/asia-pacific/2026/bse-clearing-ltd-formerly-iccl-excellence-in-central-counterparty-resilience-management-india-2026/",
    "author": "CFI.co Editorial",
    "published": "2026-09-16 11:11:06",
    "published_gmt": "2026-09-16 10:11:06",
    "modified_gmt": "2026-09-16 11:08:35",
    "categories": [
        "Asia Pacific",
        "Best Practice",
        "Exchanges &amp; Brokers",
        "Technology"
    ],
    "classification": {
        "content_class": "award_rationale",
        "editorial_lens": "constructive_positive_lens",
        "independence_status": "independent_editorial",
        "sponsor_disclosure": "none",
        "sponsor_name": "",
        "article_status": "published",
        "historical_status": "current_at_publication",
        "correction_status": "none",
        "archive_policy": "no_delete",
        "provenance_layer": "github_versioned",
        "wayback_status": "not_found",
        "wayback_first_snapshot": "",
        "wayback_snapshot_url": "",
        "license": "CFI-OAAL-1.0"
    },
    "excerpt": "",
    "content_html": "<img class=\"aligncenter size-full wp-image-13623\" src=\"https://cfi.co/awards/wp-content/uploads/2026/09/BSEClearingLtdFormerlyICCL.jpg\" alt=\"BSE Clearing ltd (formerly ICCL)\" width=\"500\" height=\"289\" />\r\n<p style=\"text-align: justify;\"><strong>In June 2026, BSE Clearing ltd, formerly Indian Clearing Corporation Ltd (ICCL), aligned its identity with BSE Ltd, the stock exchange that wholly owns it. The change retained its responsibility for novation and settlement assurance on BSE's platforms.</strong></p>\r\n<p style=\"text-align: justify;\">A multi-layered margin framework combines value-at-risk, extreme-loss and additional concentration margins with intraday mark-to-market settlement, collateral monitoring, exposure controls and stress safeguards. Back-testing, sensitivity analysis and model reviews support adjustments as conditions change. The architecture distributes risk decisions across complementary defences, including protection against concentrated directional exposures.</p>\r\n<p style=\"text-align: justify;\">Predictive analytics draw on one-minute data snapshots collected since February 2024 across more than 10m active clients. The models identify member behaviour under implied-volatility stress and inform margin and collateral decisions, supporting efficient collateral use alongside appropriate safeguards.</p>\r\n<p style=\"text-align: justify;\">Interoperability has made trade-to-risk latency a central operational consideration. BSE Clearing clears transactions originating on other Indian exchanges and has reduced average latency from trade generation to risk management and collateral allocation to 0.2 seconds. At its disaster-recovery site, with trades travelling about 2,000 kilometres, the 99th percentile remains below one second.</p>\r\n<p style=\"text-align: justify;\">Market-wide contingency planning includes a SAS-based arrangement tested during a dedicated Saturday session. Should another Indian clearing corporation fail, BSE Clearing can assume its risk-management workload alongside its own within 75 minutes. A default insurance cover, settlement guarantee fund and T+0 settlement capability provide further resilience.</p>\r\n<p style=\"text-align: justify;\">These measures demonstrate how governance, technology and tested contingencies can support settlement certainty under routine and stressed conditions. The Capital Finance International (CFI.co) Judging Panel congratulates BSE Clearing ltd on winning the Excellence in Central Counterparty Resilience Management 2026 Award (India).</p>",
    "content_text": "In June 2026, BSE Clearing ltd, formerly Indian Clearing Corporation Ltd (ICCL), aligned its identity with BSE Ltd, the stock exchange that wholly owns it. The change retained its responsibility for novation and settlement assurance on BSE's platforms.\n\nA multi-layered margin framework combines value-at-risk, extreme-loss and additional concentration margins with intraday mark-to-market settlement, collateral monitoring, exposure controls and stress safeguards. Back-testing, sensitivity analysis and model reviews support adjustments as conditions change. The architecture distributes risk decisions across complementary defences, including protection against concentrated directional exposures.\n\nPredictive analytics draw on one-minute data snapshots collected since February 2024 across more than 10m active clients. The models identify member behaviour under implied-volatility stress and inform margin and collateral decisions, supporting efficient collateral use alongside appropriate safeguards.\n\nInteroperability has made trade-to-risk latency a central operational consideration. BSE Clearing clears transactions originating on other Indian exchanges and has reduced average latency from trade generation to risk management and collateral allocation to 0.2 seconds. At its disaster-recovery site, with trades travelling about 2,000 kilometres, the 99th percentile remains below one second.\n\nMarket-wide contingency planning includes a SAS-based arrangement tested during a dedicated Saturday session. Should another Indian clearing corporation fail, BSE Clearing can assume its risk-management workload alongside its own within 75 minutes. A default insurance cover, settlement guarantee fund and T+0 settlement capability provide further resilience.\n\nThese measures demonstrate how governance, technology and tested contingencies can support settlement certainty under routine and stressed conditions. The Capital Finance International (CFI.co) Judging Panel congratulates BSE Clearing ltd on winning the Excellence in Central Counterparty Resilience Management 2026 Award (India).",
    "content_sha256": "bd4b239928646ccd13b6a9e29b7f17ccccb6d72989812f409fbb19ee79504b9a",
    "record_sha256": "0ce55fc8271f5c353dade376ddf370ad7edb461cc759b3ed685613a9e1eaa62d"
}
