{
    "id": 12834,
    "title": "Zambia National Building Society: Best Mortgage Provider Zambia 2024",
    "slug": "zambia-national-building-society-best-mortgage-provider-zambia-2024",
    "url": "https://cfi.co/awards/africa/2024/zambia-national-building-society-best-mortgage-provider-zambia-2024/",
    "author": "CFI.co Editorial",
    "published": "2024-09-29 12:35:53",
    "published_gmt": "2024-09-29 11:35:53",
    "modified_gmt": "2025-01-29 12:38:47",
    "categories": [
        "Africa"
    ],
    "classification": {
        "content_class": "award_rationale",
        "editorial_lens": "constructive_positive_lens",
        "independence_status": "independent_editorial",
        "sponsor_disclosure": "none",
        "sponsor_name": "",
        "article_status": "published",
        "historical_status": "current_at_publication",
        "correction_status": "none",
        "archive_policy": "no_delete",
        "provenance_layer": "github_versioned",
        "wayback_status": "archived",
        "wayback_first_snapshot": "20250209173203",
        "wayback_snapshot_url": "http://web.archive.org/web/20250209173203/https://cfi.co/awards/africa/2024/zambia-national-building-society-best-mortgage-provider-zambia-2024/",
        "license": "CFI-OAAL-1.0"
    },
    "excerpt": "",
    "content_html": "<img class=\"aligncenter size-full wp-image-12836\" src=\"https://cfi.co/awards/wp-content/uploads/2025/01/ZNBS.jpg\" alt=\"ZNBS\" width=\"600\" height=\"135\" />\r\n<p style=\"text-align: justify;\">Zambia National Building Society (ZNBS) is a leader in Zambia’s housing finance sector, with over 50 years of experience. ZNBS operates across all provinces, offering a wide range of affordable mortgage products, including diaspora mortgages, unsecured housing loans, and financing for bare land. In recent years, ZNBS has introduced innovative solutions such as group mortgages, enabling multiple applicants to share a mortgage, and alternative energy financing, which helps homeowners adopt solar energy. The organisation is deeply committed to affordable housing, having assisted over 2400 families in securing homeownership in the past year. ZNBS has also partnered with key stakeholders to roll out large housing projects across Zambia, including the Kwathu Hills project in Chilanga, which will feature over 135 serviced plots. By acquiring land banks and developing infrastructure, ZNBS aims to reduce housing costs and unlock economic potential for more Zambians. Their efforts have not only contributed to reducing Zambia’s housing deficit but also created jobs, with an estimated 1800 temporary jobs generated through construction activities last year. As ZNBS continues to innovate and expand its offerings, it remains committed to sustainable development, integrating green building practices to reduce environmental impact and promote long-term environmental stewardship. With a 23 percent growth in its mortgage portfolio over the past year, ZNBS continues to lead the market with its customer-centric approach and innovative financing solutions. The CFI.co Judging Panel congratulates Zambia National Building Society on winning the 2024 award for Best Mortgage Provider (Zambia).</p>",
    "content_text": "Zambia National Building Society (ZNBS) is a leader in Zambia’s housing finance sector, with over 50 years of experience. ZNBS operates across all provinces, offering a wide range of affordable mortgage products, including diaspora mortgages, unsecured housing loans, and financing for bare land. In recent years, ZNBS has introduced innovative solutions such as group mortgages, enabling multiple applicants to share a mortgage, and alternative energy financing, which helps homeowners adopt solar energy. The organisation is deeply committed to affordable housing, having assisted over 2400 families in securing homeownership in the past year. ZNBS has also partnered with key stakeholders to roll out large housing projects across Zambia, including the Kwathu Hills project in Chilanga, which will feature over 135 serviced plots. By acquiring land banks and developing infrastructure, ZNBS aims to reduce housing costs and unlock economic potential for more Zambians. Their efforts have not only contributed to reducing Zambia’s housing deficit but also created jobs, with an estimated 1800 temporary jobs generated through construction activities last year. As ZNBS continues to innovate and expand its offerings, it remains committed to sustainable development, integrating green building practices to reduce environmental impact and promote long-term environmental stewardship. With a 23 percent growth in its mortgage portfolio over the past year, ZNBS continues to lead the market with its customer-centric approach and innovative financing solutions. The CFI.co Judging Panel congratulates Zambia National Building Society on winning the 2024 award for Best Mortgage Provider (Zambia).",
    "content_sha256": "c3baebade18ba508007189e8d46f718cb3bb639276365761cf36cdcf801551d2",
    "record_sha256": "a7a273202bd0e157983c5e1fa9240dbb3109673bf2568c356baacfd76be4cac1"
}
