{
    "id": 437,
    "title": "Employment Law Winners in the UK: Bindmans LLP",
    "slug": "employment-law-winners-in-the-uk-bindmans-llp",
    "url": "https://cfi.co/awards/europe/2013/employment-law-winners-in-the-uk-bindmans-llp/",
    "author": "CFI.co Editorial",
    "published": "2013-04-02 15:40:20",
    "published_gmt": "2013-04-02 15:40:20",
    "modified_gmt": "2015-02-27 15:30:04",
    "categories": [
        "Europe",
        "Legal",
        "Professional Services"
    ],
    "classification": {
        "content_class": "award_rationale",
        "editorial_lens": "constructive_positive_lens",
        "independence_status": "independent_editorial",
        "sponsor_disclosure": "none",
        "sponsor_name": "",
        "article_status": "published",
        "historical_status": "current_at_publication",
        "correction_status": "none",
        "archive_policy": "no_delete",
        "provenance_layer": "github_versioned",
        "wayback_status": "archived",
        "wayback_first_snapshot": "20260523041514",
        "wayback_snapshot_url": "http://web.archive.org/web/20260523041514/https://cfi.co/awards/europe/2013/employment-law-winners-in-the-uk-bindmans-llp/",
        "license": "CFI-OAAL-1.0"
    },
    "excerpt": "",
    "content_html": "<p style=\"text-align: justify;\"><strong><img class=\"aligncenter  wp-image-439\" src=\"https://cfi.co/awards/wp-content/uploads/2013/04/bindmans.jpg\" alt=\"bindmans\" width=\"150\" height=\"165\" /></strong></p>\r\n<p style=\"text-align: justify;\"><strong>According to the CFI.co judging panel, Bindmans are the rising stars of employment law in the United Kingdom and the winners of the award for 2013.</strong></p>\r\n<p style=\"text-align: justify;\">The firm, founded by Sir Geoffrey Bindman QC, is high profile with focused and intelligent employment lawyers who are making a difference and bringing in good settlements. Bindmans recently won a substantial award for an Asperger syndrome sufferer in dispute with his former law firm employer and is acting for a lap dancer who used to work at the London club Stringfellows.</p>",
    "content_text": "According to the CFI.co judging panel, Bindmans are the rising stars of employment law in the United Kingdom and the winners of the award for 2013.\n\nThe firm, founded by Sir Geoffrey Bindman QC, is high profile with focused and intelligent employment lawyers who are making a difference and bringing in good settlements. Bindmans recently won a substantial award for an Asperger syndrome sufferer in dispute with his former law firm employer and is acting for a lap dancer who used to work at the London club Stringfellows.",
    "content_sha256": "036b9b62dc12796c6c259930e5ba9933c0a933070027f1f6a907394ade316c8a",
    "record_sha256": "33b1194cba4f6474161a97b33330057a3aabaee1c03b233beaea2f4d911d70c7"
}
