{
    "id": 6383,
    "title": "Eurofragance: Best International Value Creation Growth Spain 2018",
    "slug": "eurofragance-best-international-value-creation-growth-spain-2018",
    "url": "https://cfi.co/awards/europe/2019/eurofragance-best-international-value-creation-growth-spain-2018/",
    "author": "CFI.co Editorial",
    "published": "2019-01-14 15:12:05",
    "published_gmt": "2019-01-14 15:12:05",
    "modified_gmt": "2020-07-13 10:29:19",
    "categories": [
        "Customer Satisfaction",
        "Europe"
    ],
    "classification": {
        "content_class": "award_rationale",
        "editorial_lens": "constructive_positive_lens",
        "independence_status": "independent_editorial",
        "sponsor_disclosure": "none",
        "sponsor_name": "",
        "article_status": "published",
        "historical_status": "current_at_publication",
        "correction_status": "none",
        "archive_policy": "no_delete",
        "provenance_layer": "github_versioned",
        "wayback_status": "archived",
        "wayback_first_snapshot": "20190723011332",
        "wayback_snapshot_url": "http://web.archive.org/web/20190723011332/https://cfi.co/awards/europe/2019/eurofragance-best-international-value-creation-growth-spain-2018/",
        "license": "CFI-OAAL-1.0"
    },
    "excerpt": "",
    "content_html": "[caption id=\"attachment_6589\" align=\"aligncenter\" width=\"569\"]<img class=\"size-full wp-image-6589\" src=\"https://cfi.co/awards/wp-content/uploads/2019/01/Eurofragrance-CEO-Laurent-Mercier.jpg\" alt=\"\" width=\"569\" height=\"608\" /> <strong>CEO:</strong> Laurent Mercier[/caption]\r\n<p style=\"text-align: justify;\">Eurofragance wafted into the world as a small industrial facility in 1990 when the 25-year-old founder, Santiago Sabatés, set up shop as a fragrance designer and producer. The company now has a market presence in more than 60 countries and five continents. Eurofragance has expanded from its original Barcelona base to include strategically placed, automated production facilities in Singapore, Mexico, and the US. The company has expanded, consistently hitting over 10% growth per year, and the innovation and drive of its R&amp;D department is just one factor spurring that expansion. Eurofragance has five Creative Centres, where the company works to create new scents to indulge the senses. The strategic location of the Creative Centres and production plants has afforded the company insights into promising new markets. Eurofragance has solidified its market presence in the Middle East with facilities in Dubai and Turkey. In Singapore, Eurofragance pioneered production practices that deliver Halal-compliant fragrances and promise to open the Asian market for further expansion. The company is investing in acquisitions and automation to ensure its continued growth trajectory. The CFI.co judging panel believes the company’s management style — which secured its €75m budget objective in 2018 — makes it particularly attractive to investors wishing to accompany Eurofragance in its inorganic growth path, especially with regard to its North and South American targets. Congratulations to Eurofragance, winner of the 2018 award for Best International Value Creation Growth award (Spain).</p>\r\n<img class=\"aligncenter size-full wp-image-6384\" src=\"https://cfi.co/awards/wp-content/uploads/2019/01/Eurofragrance.jpg\" alt=\"\" width=\"400\" height=\"261\" />",
    "content_text": "[caption id=\"attachment_6589\" align=\"aligncenter\" width=\"569\"] CEO: Laurent Mercier[/caption]\nEurofragance wafted into the world as a small industrial facility in 1990 when the 25-year-old founder, Santiago Sabatés, set up shop as a fragrance designer and producer. The company now has a market presence in more than 60 countries and five continents. Eurofragance has expanded from its original Barcelona base to include strategically placed, automated production facilities in Singapore, Mexico, and the US. The company has expanded, consistently hitting over 10% growth per year, and the innovation and drive of its R&D department is just one factor spurring that expansion. Eurofragance has five Creative Centres, where the company works to create new scents to indulge the senses. The strategic location of the Creative Centres and production plants has afforded the company insights into promising new markets. Eurofragance has solidified its market presence in the Middle East with facilities in Dubai and Turkey. In Singapore, Eurofragance pioneered production practices that deliver Halal-compliant fragrances and promise to open the Asian market for further expansion. The company is investing in acquisitions and automation to ensure its continued growth trajectory. The CFI.co judging panel believes the company’s management style — which secured its €75m budget objective in 2018 — makes it particularly attractive to investors wishing to accompany Eurofragance in its inorganic growth path, especially with regard to its North and South American targets. Congratulations to Eurofragance, winner of the 2018 award for Best International Value Creation Growth award (Spain).",
    "content_sha256": "75c6077ebc5092af38da182b9e57fcfb655308fe164df5088144ebe92e987f74",
    "record_sha256": "c0a9793469276806a1062acf233ca4e9432876f184f040a231c2aebe9db3609a"
}
