{
    "id": 5224,
    "title": "SBM Securities: Best Stockbroker Indian Ocean 2017",
    "slug": "sbm-securities-best-stockbroker-indian-ocean-2017",
    "url": "https://cfi.co/awards/asia-pacific/2018/sbm-securities-best-stockbroker-indian-ocean-2017/",
    "author": "CFI.co Editorial",
    "published": "2018-01-11 13:58:56",
    "published_gmt": "2018-01-11 13:58:56",
    "modified_gmt": "2018-12-04 10:13:09",
    "categories": [
        "Asia Pacific",
        "Exchanges &amp; Brokers",
        "Finance"
    ],
    "classification": {
        "content_class": "award_rationale",
        "editorial_lens": "constructive_positive_lens",
        "independence_status": "independent_editorial",
        "sponsor_disclosure": "none",
        "sponsor_name": "",
        "article_status": "published",
        "historical_status": "current_at_publication",
        "correction_status": "none",
        "archive_policy": "no_delete",
        "provenance_layer": "github_versioned",
        "wayback_status": "archived",
        "wayback_first_snapshot": "20211015230146",
        "wayback_snapshot_url": "http://web.archive.org/web/20211015230146/https://cfi.co/awards/asia-pacific/2018/sbm-securities-best-stockbroker-indian-ocean-2017/",
        "license": "CFI-OAAL-1.0"
    },
    "excerpt": "",
    "content_html": "<img class=\"aligncenter size-full wp-image-5227\" src=\"https://cfi.co/awards/wp-content/uploads/2018/01/SBM.jpg\" alt=\"\" width=\"500\" height=\"37\" />\r\n\r\n<strong>One of the main drivers of Mauritius’s push to become the premier financial hub of the countries lining the Indian Ocean basin, the publicly-listed SBM Group is one of the island nation’s largest financial services providers. In addition to its 42 domestic branches, the group has established a presence in India, Madagascar, and more recently Kenya, where it acquired earlier this year a majority stake in Fidelity Commercial Bank, now renamed as SBM Bank Kenya.</strong>\r\n<p style=\"text-align: justify;\">One of the group’s wholly-owned subsidiaries, SBM Securities Ltd, offers a comprehensive range of investment and trading options, including real-time access to the Stock Exchange of Mauritius. The firm is the only stockbroker on the island offering access to Government of Mauritius Bonds on the secondary market, in addition to operating a global fixed income desk. SBM Securities’ services also include underwriting and listing services. Thanks to its privileged access to retail clients of the SBM Group, the firm is able to handle the on-boarding of investors, organise road shows, and assist corporates with the preparation of their IPO.</p>\r\n<p style=\"text-align: justify;\">SBM Securities was the first Mauritius broker to offer both domestic and overseas clients access to derivatives trading. The SBM Securities trading desk operates on extended hours to offer clients full exposure to European equity markets and the opening of the major US exchanges.</p>\r\n<p style=\"text-align: justify;\">The CFI.co judging panel agrees that Mauritius enjoys a solid reputation as a financial centre, and within that, SBM Group is recognised as one of the most experienced and best-equipped service providers. The judges note that SBM Securities was the lead broker for the placement of $165m depository receipts for the Afreximbank, with the funds raised locally from overseas investors. The judges are pleased to offer SBM Securities the 2017 Best Stockbroker Indian Ocean Award.</p>",
    "content_text": "One of the main drivers of Mauritius’s push to become the premier financial hub of the countries lining the Indian Ocean basin, the publicly-listed SBM Group is one of the island nation’s largest financial services providers. In addition to its 42 domestic branches, the group has established a presence in India, Madagascar, and more recently Kenya, where it acquired earlier this year a majority stake in Fidelity Commercial Bank, now renamed as SBM Bank Kenya.\nOne of the group’s wholly-owned subsidiaries, SBM Securities Ltd, offers a comprehensive range of investment and trading options, including real-time access to the Stock Exchange of Mauritius. The firm is the only stockbroker on the island offering access to Government of Mauritius Bonds on the secondary market, in addition to operating a global fixed income desk. SBM Securities’ services also include underwriting and listing services. Thanks to its privileged access to retail clients of the SBM Group, the firm is able to handle the on-boarding of investors, organise road shows, and assist corporates with the preparation of their IPO.\n\nSBM Securities was the first Mauritius broker to offer both domestic and overseas clients access to derivatives trading. The SBM Securities trading desk operates on extended hours to offer clients full exposure to European equity markets and the opening of the major US exchanges.\n\nThe CFI.co judging panel agrees that Mauritius enjoys a solid reputation as a financial centre, and within that, SBM Group is recognised as one of the most experienced and best-equipped service providers. The judges note that SBM Securities was the lead broker for the placement of $165m depository receipts for the Afreximbank, with the funds raised locally from overseas investors. The judges are pleased to offer SBM Securities the 2017 Best Stockbroker Indian Ocean Award.",
    "content_sha256": "0fa26f279e0c913402517e93e71c23ac951379307a5220748ee6f19a59cc8198",
    "record_sha256": "69bd8639bf24714343310c1987c67b32e1dec2e85abd4d86c20043c6c10af6eb"
}
