{
    "id": 8517,
    "title": "Central FX Ltd: Best Currency Risk Management Partner UK 2020",
    "slug": "central-fx-ltd-best-currency-risk-management-partner-uk-2020",
    "url": "https://cfi.co/awards/europe/2020/central-fx-ltd-best-currency-risk-management-partner-uk-2020/",
    "author": "CFI.co Editorial",
    "published": "2020-12-01 10:54:26",
    "published_gmt": "2020-12-01 10:54:26",
    "modified_gmt": "2021-02-10 13:35:08",
    "categories": [
        "Europe",
        "Exchanges &amp; Brokers",
        "Finance"
    ],
    "classification": {
        "content_class": "award_rationale",
        "editorial_lens": "constructive_positive_lens",
        "independence_status": "independent_editorial",
        "sponsor_disclosure": "none",
        "sponsor_name": "",
        "article_status": "published",
        "historical_status": "current_at_publication",
        "correction_status": "none",
        "archive_policy": "no_delete",
        "provenance_layer": "github_versioned",
        "wayback_status": "archived",
        "wayback_first_snapshot": "20210120080256",
        "wayback_snapshot_url": "http://web.archive.org/web/20210120080256/https://cfi.co/awards/europe/2020/central-fx-ltd-best-currency-risk-management-partner-uk-2020/",
        "license": "CFI-OAAL-1.0"
    },
    "excerpt": "",
    "content_html": "<img class=\"aligncenter size-full wp-image-8518\" src=\"https://cfi.co/awards/wp-content/uploads/2020/12/centralfx.jpg\" alt=\"centralfx\" width=\"400\" height=\"112\" />\r\n<p style=\"text-align: justify;\">Nobody can reliably predict exchange rate movements yet many businesses are happy to adopt a best guess approach to their currency exposures. Recent fluctuations owing to COVID perfectly highlight the need for every company to have a solid and robust currency policy in place. A lack of management can lead to profit margins being erased and the cost of sales increasing without warning and this does not need to be the case. Timing and understanding are key – and Central FX insists there is no reason for this to be complicated. The London-based company represents a perfect hybrid between personal service and technology.  It has developed data-driven software called Hedgemaster that enables companies to manage their currency exposures according to their business goals. Instead of basing decisions on what is considered to be good or bad rate, instead the hedging tool focuses on cashflow forecasts. Clients can align their risk-management policy with individual growth and profitability targets. Hedgemaster continuously monitors the market to assess exposure and gives prompts when hedging action should be taken. In Hedgemaster, Central FX has developed a single tool that combines the analytical power of AI with sound hedging principles. The AI analyses input data — sales forecasts, pricing changes, hedging strategies and rate moves — to help businesses maximise opportunities. Each client will be provided with their own dedicated risk expert who will take the time to conduct an in depth understanding of the company profile and targets. They can also provide assistance in getting the best execution for the agreed hedging strategy. Central FX forges ongoing partnerships and guides clients towards strategies that minimise exposure to risk. Over the past decade, it has catered to whole variety of industries within the UK, expanding across Europe and the rest of the world. The CFI.co judging panel is impressed, and declares Central FX winner of the 2020 award for Best Currency Risk Management Partner (UK).</p>",
    "content_text": "Nobody can reliably predict exchange rate movements yet many businesses are happy to adopt a best guess approach to their currency exposures. Recent fluctuations owing to COVID perfectly highlight the need for every company to have a solid and robust currency policy in place. A lack of management can lead to profit margins being erased and the cost of sales increasing without warning and this does not need to be the case. Timing and understanding are key – and Central FX insists there is no reason for this to be complicated. The London-based company represents a perfect hybrid between personal service and technology. It has developed data-driven software called Hedgemaster that enables companies to manage their currency exposures according to their business goals. Instead of basing decisions on what is considered to be good or bad rate, instead the hedging tool focuses on cashflow forecasts. Clients can align their risk-management policy with individual growth and profitability targets. Hedgemaster continuously monitors the market to assess exposure and gives prompts when hedging action should be taken. In Hedgemaster, Central FX has developed a single tool that combines the analytical power of AI with sound hedging principles. The AI analyses input data — sales forecasts, pricing changes, hedging strategies and rate moves — to help businesses maximise opportunities. Each client will be provided with their own dedicated risk expert who will take the time to conduct an in depth understanding of the company profile and targets. They can also provide assistance in getting the best execution for the agreed hedging strategy. Central FX forges ongoing partnerships and guides clients towards strategies that minimise exposure to risk. Over the past decade, it has catered to whole variety of industries within the UK, expanding across Europe and the rest of the world. The CFI.co judging panel is impressed, and declares Central FX winner of the 2020 award for Best Currency Risk Management Partner (UK).",
    "content_sha256": "532cccc9138edf55354000dd48423536be97ce343b6e4e1ed070a0833595e470",
    "record_sha256": "ea3b35f6dd30c357d218880596522513b2e28d62de4a3ca7b18c5919e9e056dd"
}
