{
    "id": 7678,
    "title": "Krungthai Bank: Best Social Impact Bank Thailand 2019",
    "slug": "krungthai-bank-best-social-impact-bank-thailand-2019",
    "url": "https://cfi.co/awards/asia-pacific/2019/krungthai-bank-best-social-impact-bank-thailand-2019/",
    "author": "CFI.co Editorial",
    "published": "2019-10-24 13:10:04",
    "published_gmt": "2019-10-24 12:10:04",
    "modified_gmt": "2020-06-24 12:11:44",
    "categories": [
        "Asia Pacific",
        "Banking",
        "Best Practice",
        "CSR",
        "Community Engagement"
    ],
    "classification": {
        "content_class": "award_rationale",
        "editorial_lens": "constructive_positive_lens",
        "independence_status": "independent_editorial",
        "sponsor_disclosure": "none",
        "sponsor_name": "",
        "article_status": "published",
        "historical_status": "current_at_publication",
        "correction_status": "none",
        "archive_policy": "no_delete",
        "provenance_layer": "github_versioned",
        "wayback_status": "archived",
        "wayback_first_snapshot": "20201203221211",
        "wayback_snapshot_url": "http://web.archive.org/web/20201203221211/https://cfi.co/awards/asia-pacific/2019/krungthai-bank-best-social-impact-bank-thailand-2019/",
        "license": "CFI-OAAL-1.0"
    },
    "excerpt": "",
    "content_html": "<img class=\"aligncenter size-full wp-image-6197\" src=\"https://cfi.co/awards/wp-content/uploads/2018/10/Krungthai.jpg\" alt=\"Krungthai\" width=\"349\" height=\"135\" />\r\n<p style=\"text-align: justify;\">With the Thai government as a majority stakeholder, Krungthai Bank is fulfilling its mission of economic growth for the country and its citizens. Krungthai Bank has been instrumental in implementing governmental initiatives, including the National e-Payment and Cashless Society schemes. It has also brought in Thailand’s 4.0 initiative, a digital transformation to boost innovation and competitiveness. The bank contributes to the sustainable growth of the Thai economy and an improved quality of life for the Thai people by digitalising financial services across five ecosystems: mass transit, healthcare, education, government, and payments. As a commercial government bank, Krungthai Bank aims to deliver competitive shareholder returns while respecting its responsibilities to Thai society and the environment. One of the bank’s flagship products, the government welfare card, provides low-income earners with digital financial services. In the project’s second phase, Krungthai Bank distributed around 14.6 million welfare cards to underprivileged groups of the population — including the elderly, disabled people, and bed-ridden patients — for purchasing power at more than 35,000 Blue Flag shops and 24,000 nationwide vendors of the Thung Ngern Pracharat app. The app makes it easier for store owners to collect money from social welfare card holders. Recent government efforts to boost the economy “from the grassroots up” have taken advantage of Krungthai Bank’s infrastructure to facilitate government-allotted incentives for domestic travel, as well as to provide subsidies to low-income earners nationwide. The CFI.co judging panel has followed the bank’s progress for several years and has found it be a model of integrity and responsibility. The judges present Krungthai Bank, a third-year repeat winner, with the 2019 award for Best Social Impact Bank (Thailand).</p>",
    "content_text": "With the Thai government as a majority stakeholder, Krungthai Bank is fulfilling its mission of economic growth for the country and its citizens. Krungthai Bank has been instrumental in implementing governmental initiatives, including the National e-Payment and Cashless Society schemes. It has also brought in Thailand’s 4.0 initiative, a digital transformation to boost innovation and competitiveness. The bank contributes to the sustainable growth of the Thai economy and an improved quality of life for the Thai people by digitalising financial services across five ecosystems: mass transit, healthcare, education, government, and payments. As a commercial government bank, Krungthai Bank aims to deliver competitive shareholder returns while respecting its responsibilities to Thai society and the environment. One of the bank’s flagship products, the government welfare card, provides low-income earners with digital financial services. In the project’s second phase, Krungthai Bank distributed around 14.6 million welfare cards to underprivileged groups of the population — including the elderly, disabled people, and bed-ridden patients — for purchasing power at more than 35,000 Blue Flag shops and 24,000 nationwide vendors of the Thung Ngern Pracharat app. The app makes it easier for store owners to collect money from social welfare card holders. Recent government efforts to boost the economy “from the grassroots up” have taken advantage of Krungthai Bank’s infrastructure to facilitate government-allotted incentives for domestic travel, as well as to provide subsidies to low-income earners nationwide. The CFI.co judging panel has followed the bank’s progress for several years and has found it be a model of integrity and responsibility. The judges present Krungthai Bank, a third-year repeat winner, with the 2019 award for Best Social Impact Bank (Thailand).",
    "content_sha256": "22230d8a0fe56dd466b6d9c093b5cec8d4c1113ce68e5289fc99a5db95352b1f",
    "record_sha256": "8ff2ee1667e2658dc5eab65bac04d59a74ef85b4fb1b4c6b9281b1d940a41261"
}
