{
    "id": 6796,
    "title": "BroadSpan Capital: Best Cross-Border M&A Advisory Team Latin America & The Caribbean 2019",
    "slug": "broadspan-capital-best-cross-border-ma-advisory-team-latin-america-the-caribbean-2019",
    "url": "https://cfi.co/awards/latin-america/2019/broadspan-capital-best-cross-border-ma-advisory-team-latin-america-the-caribbean-2019/",
    "author": "CFI.co Editorial",
    "published": "2019-06-28 11:37:52",
    "published_gmt": "2019-06-28 10:37:52",
    "modified_gmt": "2019-06-28 10:37:52",
    "categories": [
        "Latin America"
    ],
    "classification": {
        "content_class": "award_rationale",
        "editorial_lens": "constructive_positive_lens",
        "independence_status": "independent_editorial",
        "sponsor_disclosure": "none",
        "sponsor_name": "",
        "article_status": "published",
        "historical_status": "current_at_publication",
        "correction_status": "none",
        "archive_policy": "no_delete",
        "provenance_layer": "github_versioned",
        "wayback_status": "archived",
        "wayback_first_snapshot": "20190723005149",
        "wayback_snapshot_url": "http://web.archive.org/web/20190723005149/https://cfi.co/awards/latin-america/2019/broadspan-capital-best-cross-border-ma-advisory-team-latin-america-the-caribbean-2019/",
        "license": "CFI-OAAL-1.0"
    },
    "excerpt": "",
    "content_html": "<img class=\"aligncenter size-full wp-image-6797\" src=\"https://cfi.co/awards/wp-content/uploads/2019/06/BroadSpan.jpg\" alt=\"\" width=\"421\" height=\"120\" />\r\n<p style=\"text-align: justify;\">With headquarters in Miami and interests throughout Latin America and the Caribbean, BroadSpan Capital is a boutique firm providing the reach and quality of a large investment bank. Founded in 2001, the firm provides investment banking and advisory services to corporate clients and government agencies to facilitate cross-border mergers, acquisitions, financial restructurings, and capital raising. The firm is driven by a first class team that internalises BroadSpan’s immutable principles of integrity and professionalism, and fortified by each team member’s expertise in emerging markets and international finance. BroadSpan attributes its success to its work force of experienced, multi-lingual professionals, building trust with clients over the years by providing fiduciary advice of the highest quality — responsive, reliable, and value- added. BroadSpan has offices in Miami, Rio de Janeiro, Sao Paulo, and Bogota, ensuring agility and local expertise of its geographically focused portfolio of projects, with a specialisation in Latin America and the Caribbean. Continuous expansion of the region is the strategic focus over the next five years, and BroadSpan’s leadership has sights set for possible development in Mexico. Through collaborative agreements and strategic partnerships, the firm has unlocked new markets and expanded its global reach, offering merger and acquisition (M&amp;A) advisory solutions and services through affiliate offices in 30 countries around the world. The firm first came to the attention of the CFI.co judging panel from business leaders who trust BroadSpan to provide informed, independent, and objective advice — but it’s the indomitable spirit and demonstrated resilience that cinched the deal. The judges unanimously declare BroadSpan Capital as the winner of the 2019 Best Cross-Border M&amp;A Advisory Team (Latin America &amp; The Caribbean) award.a</p>",
    "content_text": "With headquarters in Miami and interests throughout Latin America and the Caribbean, BroadSpan Capital is a boutique firm providing the reach and quality of a large investment bank. Founded in 2001, the firm provides investment banking and advisory services to corporate clients and government agencies to facilitate cross-border mergers, acquisitions, financial restructurings, and capital raising. The firm is driven by a first class team that internalises BroadSpan’s immutable principles of integrity and professionalism, and fortified by each team member’s expertise in emerging markets and international finance. BroadSpan attributes its success to its work force of experienced, multi-lingual professionals, building trust with clients over the years by providing fiduciary advice of the highest quality — responsive, reliable, and value- added. BroadSpan has offices in Miami, Rio de Janeiro, Sao Paulo, and Bogota, ensuring agility and local expertise of its geographically focused portfolio of projects, with a specialisation in Latin America and the Caribbean. Continuous expansion of the region is the strategic focus over the next five years, and BroadSpan’s leadership has sights set for possible development in Mexico. Through collaborative agreements and strategic partnerships, the firm has unlocked new markets and expanded its global reach, offering merger and acquisition (M&A) advisory solutions and services through affiliate offices in 30 countries around the world. The firm first came to the attention of the CFI.co judging panel from business leaders who trust BroadSpan to provide informed, independent, and objective advice — but it’s the indomitable spirit and demonstrated resilience that cinched the deal. The judges unanimously declare BroadSpan Capital as the winner of the 2019 Best Cross-Border M&A Advisory Team (Latin America & The Caribbean) award.a",
    "content_sha256": "783e7a8c1af7166e63e485481a252d2104498c4a4b92336d0eef926285890a4c",
    "record_sha256": "4654f5bfb7f14083c2fa626b7192a382b4cebb1a39acf789d55a7b0c3973c1be"
}
